0,1572674961,2,z5102636,you can come my office. I will show you
1,1570241361,6,z1111111,I can join your team!!
2,1572804561,4,z1111112,it is in J17 level 3
3,1573431081,5,z1111113,we also not yet start!Don't warry
4,1570842672,10,z1111114,can you send you method to my email?
5,1570856532,10,z1111117,can you send you method to my email too?
6,1572674961,0,z5102636,I checked the possibility that some other student has linked his GitHub account to your zID. I am spending a lot of time to resolve those mistakes and I have still a few.